{
  "$schema": "http://json-schema.org/draft-07/schema#",
  "title": "decomposition.json",
  "description": "Ticket breakdown produced by /decompose. Validated by you, then consumed one subtask at a time by /plan.",
  "type": "object",
  "required": ["ticket", "tracker", "title", "recipe", "subtasks"],
  "properties": {
    "ticket": { "type": "string", "description": "Raw tracker ID, e.g. REGIS-142 or DEV-317" },
    "tracker": { "type": "string", "enum": ["jira", "linear"] },
    "title": { "type": "string" },
    "recipe": {
      "type": "string",
      "description": "Matched recipe name, or \"no-match\" when handed back",
      "enum": ["trivial-bug", "complex-bug", "new-field", "new-page", "new-endpoint", "module", "no-match"]
    },
    "created": { "type": "string", "format": "date" },
    "needs_human_review": {
      "type": "boolean",
      "description": "true when a subtask is destructive, the ticket didn't match a recipe, or scope is unclear. Blocks auto-advance in /ship."
    },
    "subtasks": {
      "type": "array",
      "description": "Ordered subtasks. Each becomes its own /plan run with its own slug, spec, and plan.json.",
      "items": {
        "type": "object",
        "required": ["id", "slug", "title", "goal", "seam"],
        "properties": {
          "id": { "type": "string", "description": "Two-digit ordinal, e.g. \"01\". depends_on references these." },
          "slug": { "type": "string", "description": "<ticket>-<id>-<kebab-title>, e.g. REGIS-142-01-tenants-mock. Becomes the /plan slug." },
          "title": { "type": "string" },
          "goal": { "type": "string", "description": "One sentence, single outcome." },
          "seam": {
            "type": "string",
            "description": "The contract fixed up front — endpoint signature + DTO, field spec, migration name, component props. This is what lets the subtask be planned in isolation."
          },
          "scope_hint": {
            "type": "array",
            "items": { "type": "string" },
            "description": "Narrowest glob(s) this subtask should touch. /plan tightens this into task scopes; it is a hint, not the fence."
          },
          "depends_on": { "type": "array", "items": { "type": "string" }, "description": "Subtask ids that must complete first." },
          "parallel_safe": { "type": "boolean", "description": "true if it shares no seam with a sibling. Marks what could run together; default execution is still sequential." },
          "migration": {
            "type": ["string", "null"],
            "enum": ["simple-sql", "manual", "destructive", null],
            "description": "Migration risk class per the migration rule, or null."
          }
        }
      }
    },
    "open_questions": {
      "type": "array",
      "items": {
        "type": "object",
        "required": ["q", "owner"],
        "properties": {
          "q": { "type": "string" },
          "owner": { "type": "string" },
          "due": { "type": "string", "format": "date" }
        }
      }
    }
  }
}
