{
  "ticket": "DEV-13",
  "tracker": "linear",
  "title": "Notification enabling stays forever in loading state although the permission seems successful",
  "recipe": "trivial-bug",
  "created": "2026-07-13",
  "needs_human_review": false,
  "subtasks": [
    {
      "id": "01",
      "slug": "DEV-13-01-notification-enable-timeout",
      "title": "Stop notification enable hanging on serviceWorker.ready",
      "goal": "Enabling notifications resolves (or fails) promptly once permission is granted, so the onboarding button never stays stuck in its loading state.",
      "seam": "In src/services/notifications.ts, the post-permission `await navigator.serviceWorker.ready` in enableDailyReminder() (and the same call in bootstrap()) must not be able to block indefinitely: it becomes a bounded/non-blocking step (timeout race or fire-and-forget) so enableDailyReminder() always settles after a granted permission. NotificationScreen.handleRequest's requesting/finally flow is unchanged.",
      "scope_hint": ["src/services/notifications.ts", "src/services/notifications.spec.ts"],
      "depends_on": [],
      "parallel_safe": false,
      "migration": null
    }
  ],
  "open_questions": []
}
