{
  "ticket": "DEV-7",
  "tracker": "linear",
  "title": "Add an update-available prompt so the PWA updates in place without losing data",
  "recipe": "new-page",
  "created": "2026-07-13",
  "needs_human_review": false,
  "subtasks": [
    {
      "id": "01",
      "slug": "DEV-7-01-update-available-prompt",
      "title": "Add update-available reload prompt",
      "goal": "Switch the PWA to a controlled prompt-to-reload update flow so users apply new deploys in place, with local data preserved.",
      "seam": "vite.config.ts: VitePWA registerType 'autoUpdate' -> 'prompt' (keep strategies:'injectManifest', srcDir:'src', filename:'sw.ts'). src/sw.ts: remove top-level `await self.skipWaiting()`; keep clientsClaim(); in the existing `message` listener add a branch `if (event.data?.type === 'SKIP_WAITING') self.skipWaiting()`. New src/components/UpdatePrompt.tsx: uses `useRegisterSW` from 'virtual:pwa-register/react'; when `needRefresh` is true renders a toast 'New version available' with a Reload button calling `updateServiceWorker(true)`. Wire <UpdatePrompt/> into src/App.tsx. No changes to localStorage/IndexedDB stores.",
      "scope_hint": ["vite.config.ts", "src/sw.ts", "src/components/UpdatePrompt.tsx", "src/App.tsx"],
      "depends_on": [],
      "parallel_safe": false,
      "migration": null
    }
  ],
  "open_questions": []
}
