{
  "ticket": "REGIS-142",
  "tracker": "jira",
  "title": "Tenants list page for property managers",
  "recipe": "new-page",
  "created": "2026-07-11",
  "needs_human_review": false,
  "subtasks": [
    {
      "id": "01",
      "slug": "REGIS-142-01-tenants-mock",
      "title": "Static Tenants list mock",
      "goal": "Render the Tenants list page against hardcoded TenantDTO rows.",
      "seam": "TenantDTO = { id: string; name: string; unitCount: number; status: 'active'|'archived' }",
      "scope_hint": ["src/app/tenants/**"],
      "depends_on": [],
      "parallel_safe": true,
      "migration": null
    },
    {
      "id": "02",
      "slug": "REGIS-142-02-tenants-api",
      "title": "GET /tenants endpoint",
      "goal": "Read-only GET /tenants returning TenantDTO[] from the service layer.",
      "seam": "GET /tenants -> 200 TenantDTO[]  (same TenantDTO as 01)",
      "scope_hint": ["src/modules/tenants/**"],
      "depends_on": [],
      "parallel_safe": true,
      "migration": null
    },
    {
      "id": "03",
      "slug": "REGIS-142-03-tenants-table",
      "title": "tenants table migration",
      "goal": "Add the tenants table (additive, reversible).",
      "seam": "migration create_tenants_table; up: create table; down: drop table",
      "scope_hint": ["migrations/**"],
      "depends_on": ["02"],
      "parallel_safe": false,
      "migration": "simple-sql"
    },
    {
      "id": "04",
      "slug": "REGIS-142-04-tenants-wireup",
      "title": "Wire mock to live endpoint",
      "goal": "Replace mock data with the live GET /tenants call.",
      "seam": "consumes GET /tenants -> TenantDTO[] (frozen by 01/02)",
      "scope_hint": ["src/app/tenants/**"],
      "depends_on": ["01", "02", "03"],
      "parallel_safe": false,
      "migration": null
    },
    {
      "id": "05",
      "slug": "REGIS-142-05-tenants-polish",
      "title": "Loading / empty / error states",
      "goal": "Add loading, empty, and error states to the Tenants page.",
      "seam": "UI states only; no data contract change",
      "scope_hint": ["src/app/tenants/**"],
      "depends_on": ["04"],
      "parallel_safe": false,
      "migration": null
    }
  ],
  "open_questions": []
}
